{
   "issuer":"https://%(hostname)s",
   "baseEndpoint":"https://%(hostname)s/fido2/restv1",
   "cleanServiceInterval":60,
   "cleanServiceBatchChunkSize":10000,
   "useLocalCache":true,
   "disableJdkLogger":true,
   "loggingLevel":"INFO",
   "loggingLayout":"text",
   "externalLoggerConfiguration":"",
   "disableExternalLoggerConfiguration": true,
   "metricReporterInterval":300,
   "metricReporterKeepDataDays":15,
   "metricReporterEnabled":true,
   "personCustomObjectClassList":[
      "gluuCustomPerson",
      "gluuPerson"
   ],
   "superGluuEnabled": false,
   "sessionIdPersistInCache": false,
   "oldU2fMigrationEnabled": true,
   "errorReasonEnabled": false,
   "fido2Configuration":{
      "authenticatorCertsFolder":"%(fido2ConfigFolder)s/authenticator_cert",
      "mdsCertsFolder":"%(fido2ConfigFolder)s/mds/cert",
      "mdsTocsFolder":"%(fido2ConfigFolder)s/mds/toc",
      "serverMetadataFolder":"%(fido2ConfigFolder)s/server_metadata",
      "requestedCredentialTypes":[
         "RS256",
         "ES256"
      ],
      "requestedParties":[
         {
            "name":"https://%(hostname)s",
            "domains":[
               "%(hostname)s"
            ]
         }
      ],
      "userAutoEnrollment":false,
      "unfinishedRequestExpiration":180,
      "authenticationHistoryExpiration":1296000,
      "metadataUrlsProvider":"",
      "skipDownloadMdsEnabled":false,
      "skipValidateMdsInAttestationEnabled":false,
      "assertionOptionsGenerateEndpointEnabled":true
   }
}
